{
  "schema_version": "bookmark-1",
  "bookmark_uuid": "33333333-3333-4333-8333-333333333333",
  "case_uuid": "11111111-1111-4111-8111-111111111111",
  "target_kind": "evidence_object",
  "target_ref": "22222222-2222-4222-8222-222222222222",
  "citation": "Evidence object cited for Prefetch hit",
  "author_role": "examiner",
  "created_at_utc": "2026-07-17T00:00:00Z",
  "review_state": "open",
  "tags": ["prefetch"]
}
